{
    "name": "workflow_agent",
    "domain": ["workflow", "automation"],
    "inputs": {
      "type": "json",
      "format": "task_data"
    },
    "outputs": {
      "type": "json"
    },
    "author": "your_name_here",
    "version": "1.0.0",
    "capabilities": ["execute", "chainable", "memory_access"],
    "runtime": "python3"
  }
  